[
  {
    "id": "m091",
    "slug": "emotion-faces",
    "name": "Как се чувства",
    "category": "social-emotional",
    "tier": 2,
    "value": 8,
    "engine": "matching",
    "ageMin": 3,
    "ageMax": 8,
    "difficulty": [1, 3],
    "goal": "Детето разпознава основните чувства по лице и получава думи за тях — да назовеш чувството е първата стъпка към справянето с него.",
    "skills": ["emotion-recognition", "vocabulary", "visual-discrimination"],
    "loop": "Показват се лица с различни изражения; детето избира търсеното чувство.",
    "rules": [
      "Само основните чувства: радост, тъга, яд, страх, изненада",
      "Изражението е ясно и преувеличено",
      "Чувството се назовава и се показва с дума"
    ],
    "feedback": [
      "Лицето се раздвижва и показва чувството по-изразено",
      "Думата се изписва под лицето"
    ],
    "animation": ["Раздвижване на изражението", "Появяване на думата"],
    "audio": ["Изговорена дума за чувството", "correct при верен избор"],
    "a11y": [
      "Чувството се показва с форма на веждите и устата, не с цвят",
      "Думата се изписва — работи без звук",
      "Едри лица"
    ],
    "themes": ["body"],
    "variations": [
      "Три чувства при 3 г., пет при 8 г.",
      "Лице спрямо цяла поза на тялото",
      "Едно и също чувство при различни герои"
    ],
    "noFail": true,
    "assetsNeeded": ["object"]
  },
  {
    "id": "m092",
    "slug": "emotion-in-context",
    "name": "Защо се чувства така",
    "category": "social-emotional",
    "tier": 3,
    "value": 7,
    "engine": "matching",
    "ageMin": 5,
    "ageMax": 8,
    "difficulty": [2, 4],
    "goal": "Детето свързва чувството с причината му — стъпката от разпознаване към разбиране на другия.",
    "skills": ["emotion-recognition", "social-reasoning", "logic"],
    "loop": "Показва се случка; детето избира как се чувства героят в нея.",
    "rules": [
      "Случките са от детското ежедневие",
      "Причината е ясна и еднозначна",
      "Три-четири възможни чувства"
    ],
    "feedback": [
      "Изражението на героя се появява при верен избор",
      "Случката и чувството остават заедно като цяла картинка"
    ],
    "animation": ["Появяване на изражението върху героя"],
    "audio": ["correct при верен избор"],
    "a11y": [
      "Случката е показана изцяло визуално",
      "Без ограничение във времето"
    ],
    "themes": ["home", "garden", "toys"],
    "variations": [
      "Ясна причина спрямо по-тънка",
      "Едно спрямо две деца в случката",
      "Смесени чувства — само за най-големите"
    ],
    "noFail": false,
    "assetsNeeded": ["scene", "object"]
  },
  {
    "id": "m093",
    "slug": "what-would-you-do",
    "name": "Какво да направим",
    "category": "social-emotional",
    "tier": 3,
    "value": 7,
    "engine": "matching",
    "ageMin": 5,
    "ageMax": 8,
    "difficulty": [2, 4],
    "goal": "Детето обмисля как да постъпи в проста социална ситуация, вместо да получава готово правило.",
    "skills": ["social-reasoning", "problem-solving", "emotion-recognition"],
    "loop": "Показва се ситуация; детето избира най-добрия отговор измежду няколко.",
    "rules": [
      "Ситуациите са ежедневни: приятел пада, играчка се счупва",
      "Всички варианти са показани като действия, не като текст",
      "Няма наказание за избрания вариант — показва се последствието"
    ],
    "feedback": [
      "Избраният вариант се разиграва и се вижда какво следва",
      "Реакцията на другия герой показва въздействието"
    ],
    "animation": ["Разиграване на последствието от избора"],
    "audio": ["Мек звук при разиграване", "correct при добър избор"],
    "a11y": [
      "Всичко е показано, нищо не се чете",
      "Без укор при по-слаб избор — само последствие"
    ],
    "themes": ["home", "garden", "toys"],
    "variations": [
      "Помощ на другия",
      "Споделяне",
      "Извинение"
    ],
    "noFail": false,
    "assetsNeeded": ["scene", "object"]
  },
  {
    "id": "m094",
    "slug": "taking-turns",
    "name": "Редът е на",
    "category": "social-emotional",
    "tier": 4,
    "value": 5,
    "engine": "sequencing",
    "ageMin": 4,
    "ageMax": 7,
    "difficulty": [1, 3],
    "goal": "Детето усвоява редуването и чакането на ред — умение, което определя дали груповата игра ще върви.",
    "skills": ["social-reasoning", "sequencing", "inhibitory-control"],
    "loop": "Няколко герои чакат на опашка; детето следи чий е редът и го подава.",
    "rules": [
      "Редът е ясно показан със стрелка",
      "Изпуснат ред само се показва наново",
      "Опашката е от 3 до 5 героя"
    ],
    "feedback": [
      "Героят на ред се откроява",
      "Обслуженият герой отива в края на опашката видимо"
    ],
    "animation": ["Открояване на чакащия на ред", "Придвижване на опашката"],
    "audio": ["chime при смяна на реда", "correct при вярно подаване"],
    "a11y": [
      "Редът се показва със стрелка, не само се обявява",
      "Без ограничение във времето"
    ],
    "themes": ["garden", "toys", "farm"],
    "variations": [
      "Три героя спрямо пет",
      "Постоянен ред спрямо сменящ се",
      "Пропускане на ред при определено условие"
    ],
    "noFail": true,
    "assetsNeeded": ["object", "scene"]
  },
  {
    "id": "m095",
    "slug": "daily-routine",
    "name": "Денят по ред",
    "category": "everyday-knowledge",
    "tier": 2,
    "value": 8,
    "engine": "sequencing",
    "ageMin": 3,
    "ageMax": 7,
    "difficulty": [1, 3],
    "goal": "Детето подрежда деня си и получава усещане за време и предвидимост — а предвидимостта успокоява.",
    "skills": ["sequencing", "everyday-knowledge", "narrative"],
    "loop": "Разбъркани картинки от деня; детето ги подрежда от сутрин до вечер.",
    "rules": [
      "От 3 картинки при 3 г. до 6 при 7 г.",
      "Случките са от собствения ден на детето",
      "Поставена картинка може да се премести"
    ],
    "feedback": [
      "Слънцето се движи по небето успоредно с подредбата",
      "Готовата редица се разиграва като кратък ден"
    ],
    "animation": ["Слънце, което се движи с подредбата", "Разиграване на деня накрая"],
    "audio": ["snap при поставяне", "complete при вярна подредба"],
    "a11y": [
      "Всичко е визуално",
      "Едри картинки",
      "Без ограничение във времето"
    ],
    "themes": ["home", "food", "body"],
    "variations": [
      "Само сутрин спрямо цял ден",
      "Делник спрямо празник",
      "Ред на обличане вместо ред на деня"
    ],
    "noFail": true,
    "assetsNeeded": ["scene", "object"]
  },
  {
    "id": "m096",
    "slug": "seasons-weather",
    "name": "Кое време е",
    "category": "everyday-knowledge",
    "tier": 3,
    "value": 7,
    "engine": "matching",
    "ageMin": 4,
    "ageMax": 8,
    "difficulty": [2, 3],
    "goal": "Детето свързва време, сезон и подходящо облекло — знание за света, което се използва всеки ден.",
    "skills": ["everyday-knowledge", "classification", "vocabulary"],
    "loop": "Показва се време или сезон; детето избира какво му подхожда.",
    "rules": [
      "Четирите сезона и основните видове време",
      "Връзката е ясна и еднозначна",
      "Три-четири възможности"
    ],
    "feedback": [
      "Сцената се променя според избора и показва резултата",
      "Героят се облича подходящо при верен избор"
    ],
    "animation": ["Промяна на сцената според времето", "Обличане на героя"],
    "audio": ["Звук на времето: дъжд, вятър", "correct при верен избор"],
    "a11y": [
      "Времето е показано и с картинка, и с промяна на сцената",
      "Работи без звук"
    ],
    "themes": ["weather", "seasons", "clothes", "garden"],
    "variations": [
      "Време спрямо облекло",
      "Сезон спрямо дейност",
      "Сезон спрямо промяна в дървото"
    ],
    "noFail": true,
    "assetsNeeded": ["scene", "object"]
  },
  {
    "id": "m097",
    "slug": "safety-choice",
    "name": "Кое е опасно",
    "category": "everyday-knowledge",
    "tier": 2,
    "value": 8,
    "engine": "odd-one-out",
    "ageMin": 4,
    "ageMax": 8,
    "difficulty": [1, 3],
    "goal": "Детето разпознава ежедневни опасности — рядко умение в игрите и с най-пряка полза в живота.",
    "skills": ["everyday-knowledge", "social-reasoning", "logic"],
    "loop": "Показва се сцена от дома или улицата; детето посочва кое в нея е опасно.",
    "rules": [
      "Опасностите са ежедневни: горещ котлон, отворен прозорец, улица",
      "Показва се какво да се направи, не само какво е опасно",
      "Никога не се показва нараняване"
    ],
    "feedback": [
      "Опасността се огражда и се показва безопасното действие",
      "Сцената става безопасна при вярно посочване"
    ],
    "animation": ["Ограждане на опасността", "Превръщане на сцената в безопасна"],
    "audio": ["chime при посочване", "correct при вярно решение"],
    "a11y": [
      "Никога не се показва пострадало дете — само предотвратяване",
      "Всичко е визуално",
      "Без ограничение във времето"
    ],
    "themes": ["home", "city", "garden"],
    "variations": [
      "Кухня",
      "Улица и движение",
      "Двор и вода"
    ],
    "noFail": true,
    "assetsNeeded": ["scene", "object"]
  },
  {
    "id": "m098",
    "slug": "time-of-day",
    "name": "Кога става това",
    "category": "everyday-knowledge",
    "tier": 4,
    "value": 6,
    "engine": "matching",
    "ageMin": 5,
    "ageMax": 8,
    "difficulty": [2, 4],
    "goal": "Детето свързва занимание с част от деня и прави първата крачка към разчитане на часовник.",
    "skills": ["everyday-knowledge", "sequencing", "vocabulary"],
    "loop": "Показва се занимание; детето избира сутрин, обед, следобед или вечер.",
    "rules": [
      "Четири части на деня, показани с небето и слънцето",
      "Заниманията са еднозначно свързани с една част",
      "Часовникът се показва успоредно за по-големите"
    ],
    "feedback": [
      "Небето се сменя според избора",
      "Стрелките на часовника се завъртат при верен избор"
    ],